{
  "id": "c81ee812-a836-45e8-9998-90990e757101",
  "slug": "example-project",
  "canonicalPath": "/projects/example-project",
  "title": "Example Project (placeholder)",
  "summary": "Illustrative fictional structure only, not real user work.",
  "kind": "project",
  "publishedAt": "2026-10-23T00:00:00Z"
}
